{
  "schemaVersion": "1.1.0",
  "dataKind": "measured",
  "runId": "audit-feature-frontier-raw-r1",
  "benchmarkVersion": "specforge-fsi-v1.0.0",
  "episodeId": "audit-feature",
  "laneId": "frontier-raw",
  "model": {
    "id": "claude-opus-5",
    "displayName": "Claude Opus 5",
    "tier": "frontier",
    "buildId": "not-exposed-by-copilot"
  },
  "inputMode": "raw",
  "repetition": 1,
  "baseline": {
    "ref": "refs/tags/benchmark-modernized-v1",
    "commit": "806344ba17e194b54d0e645455829ab05c58fb6c",
    "sha256": "82ff4d70d1423d45cb25e2d714355500d22b31eb6c8f47c5f5f246d4f4662120"
  },
  "brief": {
    "path": "benchmark/prompts/audit-feature-raw.md",
    "sha256": "f47aa4cd40324a29be02f62a6f7fb8c900a72017ad565ca3b3e7756e343d648d"
  },
  "spec": null,
  "frozenInputs": {
    "freezeRecordSha256": "edd523966c35daa42a6ad2306670157c90336232bac20b3c6f3e88c27a66ef30",
    "evaluatorSha256": "1540f263481cae49fa84bc8d187c5e1b503cc5775f41f24da1e54339870c8946",
    "scoringConfigSha256": "c9e7c3bebd575b3b56f0409d69cdb5d952c175a73ec11ada7599d73a9648bac6",
    "costsConfigSha256": "3b2c5ed227eef9cb46c8686dca1bd76af97e2f50e36729358ebc7c9d00dc5ea5",
    "benchmarkEngineSha256": "848140d8340397b49926e4b1a05cca6a873850ee2822eb8ad8d654e3078dab9a",
    "promptSha256": "f47aa4cd40324a29be02f62a6f7fb8c900a72017ad565ca3b3e7756e343d648d",
    "experimentConfigSha256": "b7f2dd0b8a5990a4264412829ede8e05fcb0a20fd7814cba902a01ac54f3276f",
    "runSchemaSha256": "b4cc4103ec2613d7f6ce46aef274a32b4e58a63cebeaccefc609f645606ccf11",
    "reportSchemaSha256": "b1b050eba32e96cb059d542ea21114e7d91d8e88cc22f74bc9b867be45187204"
  },
  "execution": {
    "status": "completed",
    "order": 10,
    "startedAt": "2026-08-18T12:24:16.931Z",
    "endedAt": "2026-08-18T13:49:03.840Z",
    "elapsedSeconds": 5086.909,
    "productiveSeconds": 1424.184,
    "queueSeconds": 8.981,
    "modelId": "claude-opus-5",
    "modelBuildId": "not-exposed-by-copilot",
    "agentVersion": "1.0.79-9",
    "agentBuildId": "not-separately-exposed-by-copilot",
    "reasoningEffort": "high",
    "toolCalls": 103,
    "inputTokens": 488004,
    "cachedInputTokens": 8146267,
    "outputTokens": 116842,
    "reasoningTokens": 35663,
    "estimatedCostUsd": null,
    "specAuthoringCostUsd": null,
    "firstGreenBuildSeconds": null,
    "firstPassingSuiteSeconds": null,
    "reworkCount": 0,
    "scopeChurnFiles": 27
  },
  "source": {
    "commit": "c3359a429cc1b1453c8877a08eff1bdac2787fc0",
    "diffPath": "evidence/measured/runs/audit-feature-frontier-raw-r1/candidate.patch",
    "diffSha256": "1961ae27251aece7c0e3ceb21d827cc5b862713012b99815dcdbca1071c490b5",
    "bundlePath": "evidence/measured/runs/audit-feature-frontier-raw-r1/source.bundle",
    "bundleSha256": "cf26055a01ce970ab8347b59dfef40634412b96d49295df0bbc454472963f9e7"
  },
  "evidence": {
    "directory": "evidence/measured/runs/audit-feature-frontier-raw-r1/evidence",
    "transcriptPath": "evidence/measured/runs/audit-feature-frontier-raw-r1/evidence/transcript.jsonl",
    "transcriptSha256": "26e7dbb9147a867bb54eaf1db79cd644c1da4d599de1ce987db401619d58917d",
    "evaluatorPath": "evidence/measured/runs/audit-feature-frontier-raw-r1/evidence/evaluator.json",
    "evaluatorSha256": "573709093a6c679ebd4a877ffb6ae3c8a1bf7b09d5f2c1cd0fc6a5c740b0cbf7"
  }
}
